eid	title	author	firstpage	lastpage	pages
TH3-55	Aberrations of the Spin of Polarized Protons in a Linac	N. Golubeva and Yu. Senichev	663	665	663-665
TH3-56	New Features of the $∆t$-Procedure for an Intensive Ion Linac	G. Dubinsky and A. Reshetov and Yu. Senichev and E. Shaposhnikova	666	668	666-668
TH3-57	Problems of the Beam Loss in Intense Ion Linear Accelerators	N. Golubeva and A. Pashenkov and Yu. Senichev and E. Shaposhnikova	669	674	669-674
FR1-01	{B}-Factories: A Perspective of {B}-Physics and Possible Accelerator Design Approaches	R. Siemann	675	679	675-679
FR1-02	Work on Superconducting Linacs in Progress in {Frascati}	S. Tazzari and A. Aragona and C. Biscari and R. Boni and M. Castellano and A. Cattoni and V. Chimenti and S. De Simone and S. Faini and U. Gambardella and S. Guiducci and S. Kukinski and L. Maritato and G. Modestino and P. Patteri and M. A. Preger and C. Sanelli and M. Serio and B. Spataro and F. Tazzioli and M. Vescovi and C. Pagani and N. Cavallo and F. Cevenini	680	683	680-683
FR1-04	An {FEL} Power Source for a {TeV} Linear Collider	A. Sessler and D. Hopkins and E. Hoyer and K. Halbach and R. Palmer and W. Barletta and R. Jong and L. Reginato and S. Yu and J. Bayless	684	690	684-690
FR2-01	{KEK} Plans for a Linear Collider {R&D}	G. Horikoshi and Y. Kimura and T. Nishikawa	691	695	691-695
FR2-02	The Study of a {CERN Linear Collider, CLIC}	W. Schnell	696	699	696-699
FR2-03	{SLAC} {R&D} toward a {TeV} Linear Collider	P. Wilson	700	705	700-705
