eid	title	author	firstpage	lastpage	pages
0035	A Tribute to {Nicholas C. Christofilos}	T. K. Fowler	35	35	35
0036	Impact of Accelerators on Technology	I. L. Morgan	36	39	36-39
0040	Support of Research on and with Accelerators	W. A. Wallenmeyer	40	43	40-43
0044	Progress on {RF} Electron Superconducting Accelerators	L. R. Suelzle	44	48	44-48
0049	Progress Report on Superconducting Proton Linacs	M. Kuntze	49	53	49-53
0054	Electron Multiplication in Cavities	I. Ben-Zvi and J. F. Crawford and J. P. Turneaure	54	58	54-58
0059	{RF}-Tests on Deflecting Cavities for a Superconducting Particle Separator	W. Bauer and A. Citron and G. Dammertz and H. Diepers and H. C. Eschelbacher and H. Lengeler and H. Miller and E. Rathgeber	59	62	59-62
0063	Investigations of a Superconducting Beam Tube Niobium Cavity at {S}-Band	P. Kneisel and J. Halbritter and O. Stoltz	63	67	63-67
0068	Superconducting Niobium Cavities Prepared by Electropolishing and Anodizing	H. Diepers and H. Martens and O. Schmidt and K. Schnitzke and Y. Uzel	68	70	68-70
0071	Vibration-{RF} Control of Superconducting Helix Resonators for Heavy-Ion Acceleration	O. D. Despe and K. W. Johnson and T. K. Khoe	71	75	71-75
0076	Development and Operation of a Prototype Superconducting Linac for Heavy-Ion Acceleration	J. Aron and R. Benaroya and L. M. Bollinger and K. E. Gray and A. H. Jaffey and K. W. Johnson and T. K. Khoe and J. J. Livingood and F. J. Lynch and J. M. Nixon and G. W. Parker and W. J. Ramler and W. A. Wesolowski	76	80	76-80
0081	Experience in Recirculating Electrons through a Superconducting Linac	L. M. Young	81	85	81-85
0086	Beam Breakup in a 55-Cell Superconducting Accelerator Structure	K. Mittag and H. D. Schwarz and H. A. Schwettman	86	90	86-90
0091	The {Bevatron} Cryopump	R. A. Byrns and J. T. Tanabe	91	94	91-94
0095	Superconducting Niobium Deflectors	J. R. Aggus and W. Bauer and S. Giordano and H. Hahn and H. J. Halama	95	97	95-97
0098	{3 GHz} Superconducting Accelerator Cavity for Use in an Electron Synchrotron	R. Sundelin and J. Kirchgessner and D. Rice and M. Tigner and von Borstel, E.	98	100	98-100
0101	Electron Loading in {L}- and {S}- Band Superconducting Niobium Cavities	C. Lyneis and Y. Kojima and J. P. Turnesure and N. T. Viet	101	103	101-103
0104	Recent Measurements at {SLAC} on Superconducting Niobium {X}-Band Cavities	P. B. Wilson and Z. D. Farkas and H. A. Hogg and E. W. Hoyt	104	107	104-107
0108	Investigations of Additional Losses in Superconducting Niobium Cavities due to Frozen-in Flux	B. Piosczyk and J. Halbritter and P. Kneisel and O. Stoltz	108	112	108-112
0113	Resonant Frequency Control of Superconducter {RF} Cavities	Peebles, Jr., P. Z.	113	118	113-118
0119	Superconducting Accelerator Magnet Cooling Systems	Vander Arend, P. C. and W. B. Fowler	119	121	119-121
0122	Quick Approximations for the {He₃} Points of State	F. F. Hall	122	124	122-124
0125	Large Rectangular Vacuum Windows	J. E. Walter	125	126	125-126
0127	Rapid Cycling Valve for 30-{Hz} Pulsed {H⁻} Ion Source	A. J. Gorka and K. D. Kellogg and J. S. Moenich	127	129	127-129
0130	Pressure Differential Gate Valve	J. S. Moenich and J. J. Peerson	130	130	130
0131	Titanium Vacuum Chamber Liners in the {Cornell Electron Synchrotron}	J. L. Kirchgessner	131	132	131-132
0133	Dielectric-Lined Circular Deflectors for Ultrahigh-Energy Beam Separators	C. T. M. Chang	133	135	133-135
0136	Some Advances in Negative Ion Technology	K. H. Purser	136	141	136-141
0142	Design and Operating Characteristics of the Developmental {H⁻} Ion Source for 30-{Hz} Injection into the {Argonne National Laboratory (ANL)} Booster	J. A. Fasolo and A. J. Gorka and J. S. Moenich	142	146	142-146
0147	Cyclotron Internal Ion Source with {DC} Extraction	M. L. Mallory and E. D. Hudson and R. S. Lord	147	150	147-150
0151	Progress with the {SuperHILAC}	A. Ghiorso	151	154	151-154
0155	The {Bevalac}—An Economical Facility for Very Energetic Heavy Particle Research	A. Ghiorso and H. Grunder and W. Hartsough and G. Lambertson and E. Lofgren and K. Lou and R. Main and R. Mobley and R. Morgado and W. Salsig and F. Selph	155	158	155-158
0159	Proposed Accelerator for Heavy Ions	R. H. Stokes	159	162	159-162
0163	A National Nuclear Structure Facility for {Britain}	N. R. S. Tait and R. G. P. Voss	163	167	163-167
0168	A Multi-Accelerator System for Heavy Ions	E. D. Hudson and L. N. Howell and R. S. Lord and C. A. Ludemann and M. L. Mallory and J. A. Martin and W. T. Milner and S. W. Mosko and P. H. Stelson and A. Zucker	168	172	168-172
0173	Energy Multiplication by Beam Recycling in an Isochronous Cyclotron	E. D. Hudson and H. G. Blosser and D. A. Johnson and R. S. Lord and M. L. Mallory and A. Zucker	173	177	173-177
0178	First Phase of Heavy Ion Acceleration at the {Bevatron}	K. C. Crebbin and D. M. Evans and R. J. Force and H. A. Grunder and J. R. Guggemos and W. D. Hartsough and E. J. Lofgren and F. Lothrop and K. H. Lou and R. Morgado and R. M. Richter and M. M. Tekawa and E. Zajec	178	181	178-181
0182	Production of Intense Proton Beams	P. R. Hanley and N. Wells	182	184	182-184
0185	Design and Measured Characteristics of Minimum Loss Low-Velocity Helix Resonators	P. J. Bendt and B. H. Erkkila and R. H. Stokes	185	187	185-187
0188	{RF} Losses in Helical Resonators	L. J. Laslett and K. S. Jancaitis and T. A. Tombrello	188	190	188-190
0191	Operating Results from {NAL}	{The NAL Staff}	191	197	191-197
0198	Operating Results from the {ANL} Booster	J. D. Simpson	198	201	198-201
0202	Present Status of the {590 MeV} Ring Cyclotron of {SIN}	H. A. Willax	202	206	202-206
0207	Problems and Possible Solutions for the {TRIUMF} Project	J. R. Richardson	207	212	207-212
0213	Pulsed Beam Capabilities of the {Livermore Cyclograaff}	J. C. Davis and J. D. Anderson and E. K. Freytag and D. R. Rawles	213	216	213-216
0217	Acceleration of Polarized Protons in the {Zero Gradient Synchrotron (ZGS)}	L. G. Ratner and T. K. Khoe	217	220	217-220
0221	Present Performance of the {CERN} {800 MeV} {PS Booster (PSB)}	{The PSB Staff}	221	225	221-225
0226	Performance Report on the Post Conversion {AGS}	M. Barton and K. Batchelor and L. Blumberg and J. Cottingham and J. Glenn and J. Grisoli and J. Herrera and A. Maschke and E. Raka and van Steenbergen, A.	226	230	226-230
0231	Recent Progress in the Performance of the {Desy-Electron Synchrotron}	H. Kumpfert	231	235	231-235
0236	{224 cm} Variable Energy Cyclotron at {Calcutta}	C. Ambasankaran and D. Y. Phadke	236	239	236-239
0240	Main Accelerator Abort System	R. Carrigan and W. DeLuca and R. Ducar and R. Lundy and A. Maschke and S. Mori and W. J. Pelczarski and C. Rode and L. Sauer and L. Teng and A. Visser and R. Yamada	240	242	240-242
0243	Construction Details of the {TRIUMF} {H⁻} Cyclotron	J. J. Burgerjon and O. K. Fredriksson and W. A. Grundman and A. J. Otter and B. C. Stonehill	243	247	243-247
0248	Experimental Results from the {TRIUMF} Central Region Cyclotron	E. W. Blackmore and G. Dutto and W. Joho and G. H. Mackenzie and L. Root and M. Zach	248	249	248-249
0250	LBL 184-Inch Synchrocyclotron Operational Improvements	L. R. Glasgow and L. L. Kanstein and R. W. Sorensen and J. T. Vale	250	252	250-252
0253	The Program Used to Retune the {Zero Gradient Synchrotron (ZGS)} after the Installation of a New Vacuum Chamber and Pole Face Windings	R. L. Kustom	253	256	253-256
0257	The {S.I.N.} Injector Cyclotron	A. Baan and R. A. Beelaard and N. Hazewindus and H. J. A. M. Hovers and van Nieuwland, J. M. and D. Wierts	257	259	257-259
0260	A Variable Energy Racetrack Microtron	H. R. Froelich and D. S. Edmonds and J. J. Manca and A. S. Thompson	260	262	260-262
0263	The Status Report of the {LNPI} {1 GeV} Synchrocyclotron	N. N. Chernov	263	265	263-265
0266	Some Effects at High Intensities at the 76-{GeV} Proton Synchrotron	Yu. M. Ado and E. A. Myae and E. F. Troyanov	266	267	266-267
0268	Use of {USSR} Proton Accelerators for Medical Purposes	V. P. Dzhelepov and V. M. Abasov and B. V. Astrakhan and N. N. Blokhin and L. L. Goldin and V. S. Khoroshkov and V. N. Kisileva and V. I. Komarov and M. F. Lomanov and E. I. Minakova and K. K. Onossovsky and A. I. Ruderman and O. V. Savchenko and M. S. Vajnberg	268	270	268-270
0271	Current Understanding of {ERA}	L. J. Laslett	271	275	271-275
0276	The New {Garching Fast ERA} Experiment	C. Andelfinger and W. Hermann and D. Jacobi and A.U. Luccio and W. Ott and U. Schumacher and M. Ulrich	276	279	276-279
0280	{ERA} Research in {Japan}	S. Kawasaki and G. Horikoshi and K. Huke and H. Ishizuka and Y. Kubota and A. Miyahara and H. M. Saad	280	282	280-282
0283	Recent Experiments on {ERA} in {Karlsruhe}	C.-H. Dustmann and H. Krauth and L. Steinbock and W. Zernial	283	285	283-285
0286	Production and Dynamics of High Intensity Electron Beams	G. Brautti and I. Boscolo and R. Coisson and M. Leo and A. Luches and A. Tepore	286	288	286-288
0289	The Hydra Electron Beam Generator	T. H. Martin	289	293	289-293
0294	Aurora, an Electron Accelerator	B. Bernstein and I. Smith	294	300	294-300
0301	Further Studies of Collective Acceleration of Positive Particles Using Intense Electron Beams	B. Ecker and D. Drickey and S. Putnam	301	304	301-304
0305	Ion Acceleration in Electron Beams	G. W. Kuswa and L. P. Bradley and G. Yonas	305	309	305-309
0310	Status Report on the {University of Maryland Electron Ring Accelerator} Project	M. Reiser	310	314	310-314
0315	The Problem of Coupling a 120-{MHz} {RF} Cavity to a 700-{A}, 6-{MeV} Pulsed Electron Beam	R. K. Cooper and V. K. Neil and L. L. Reginato and B. H. Smith	315	317	315-317
0318	Self Fields and Particle Oscillation Frequencies in a Rotating Electron Sheet Beam Loaded with Positive Ions	M. Reiser	318	320	318-320
0321	Injector for {Maryland E R A} Project: Design Features and Initial Performance	J. K. Burton and J. J. Condon and F. L. Desrosier and A. C. Greenwald and J. M. Henness and W. H. Lupton and M. J. Rhee and G. T. Zorn	321	323	321-323
0324	Stopping of an Electron Ring by Induced Image Currents in Resistive Wire Loops	J. G. Kalnins and H. Kim and J. G. Linhart	324	326	324-326
0327	Envelope Instabilities in Relativistic Electron Rings	D. M. LeVine	327	329	327-329
0330	Negative Mass Instability in Hollow Cylinders	D. M. LeVine	330	332	330-332
0333	Generation and Diagnosis of {TW/cm²} Electron Beams	D. G. Pellinen and S. E. Heurlin	333	335	333-335
0336	Collective Acceleration of Intense Ion Beams in Vacuum	J. S. Luce and T. R. Crites and H. L. Sahlin	336	341	336-341
0342	Multiturn Injection into the Converted {AGS}	J. Claus and H. N. Brown and M. Month and van Steenbergen, A.	342	346	342-346
0347	A Device for Bunching Relativistic Electrons	J. W. Beal and R. K. Cooper and W. A. Lamb and V. K. Neil and D. S. Prono and L. Smith and D. F. Wright	347	350	347-350
0351	Synchronous Transfer of Beam from the {NAL} Fast Cycling Booster Synchrotron to the {NAL} Main Ring System	J. A. Dinkel and J. E. Griffin and E. L. Hubbard and R. E. Peters and L. C. Teng	351	354	351-354
0355	Power Supply for {NAL} Main Ring System	R. Cassel	355	359	355-359
0360	Design Fundamentals of Current Transductors for Large {DC} Currents	L. T. Jackson	360	364	360-364
0365	An All Solid-State Line-Type Modulator for {10 %} Duty Factor	P. J. T. Bruinsma and E. Heine and G. J. Koenderink and van Koeverden Brouwer, J. J.	365	368	365-368
0369	Klystrons for Accelerator Improvements	R. L. Stringall and J. V. Lebacqz and D. L. Russell	369	372	369-372
0373	Operation of the Spear {RF} System	M. A. Allen and R. A. McConnell	373	377	373-377
0378	Twin-Tank Accelerator for {High-Voltage Electron Microscopy (HVEM)}	G. Reinhold and R. Gleyvod	378	382	378-382
0383	University of Rochester Tandem Upgrading	K. H. Purser	383	386	383-386
0387	A Fast-Spinning Stripper Mod {II} for the {Zero Gradient Synchrotron (ZGS)} Booster	A. J. Gorka	387	391	387-391
0392	Resonance Injection in the Superconducting Stretcher Ring	T. K. Khoe and R. J. Lari	392	394	392-394
0395	{Zero Gradient Synchrotron (ZGS)} High Energy Polarized Proton Beam Program-Injector System	E. F. Parker and J. Madsen and N. Sesol and R. L. Stockley and R. E. Timm	395	396	395-396
0397	{Pole Face Winding (PFW)} Equipment for Eddy Current Correction at the {Zero Gradient Synchrotron (ZGS)}	D. E. Suddeth and D. R. Schmitt and R. E. Timm and A. J. Wright	397	398	397-398
0399	An {R.F.} Modulated Electron Gun for {NINA} Injection Equipment	D. E. Poole and T. R. Charlesworth and O. Gunnill and D. G. Peters and G. Saxon	399	400	399-400
0401	New Methods for Multiturn Injection into Synchrotrons	P. F. Meads	401	402	401-402
0403	Beam Terminology	J. H. Fink and B. W. Schumacher	403	404	403-404
0405	A Pulsed Ferrite Inflector for the Emittance Measuring Device of the {Chalk River High Current Test Facility}	Pachner, Jr., J.	405	406	405-406
0407	Electrical Design of a Small Solid State Energy Discharge Power Supply	A. T. Visser and J. D. McCarthy and C. H. Rode	407	408	407-408
0409	The {NAL} Booster Synchrotron Magnet Power Supply Servo	A. R. Donaldson and R. A. Winje	409	410	409-410
0411	Performance of Transductors for Precision High-Current Measurement and Control	R. E. Fuja and W. F. Praeg	411	413	411-413
0414	{NAL} Quadrupole Power Supply Active Filter	R. J. Yarema and R. L. Cassel	414	415	414-415
0416	A New {RF} System for the {ORIC}	S. W. Mosko	416	417	416-417
0418	A 2nd {RF} System for {Nimrod}	E. G. Sandels and R. A. Church and I. S. K. Gardner and H. C. Whitby	418	421	418-421
0422	Two Megawatts {RF} Power Tetrode	S. G. McNees	422	423	422-423
0424	Half-Integer Resonance Extraction for the {NAL} Accelerator	H. T. Edwards and W. W. Lee and J. D. McCarthy and S. Ohnuma and L. C. Teng	424	427	424-427
0428	The {NAL} Beam Splitting System	L. W. Oleksiuk and R. A. Andrews and E. J. Bleser and C. H. Rode	428	433	428-433
0434	Simultaneous Resonance Extraction	E. A. Crosbie and T. K. Khoe and R. J. Lari and L. G. Ratner	434	437	434-437
0438	The Fast Shaving Ejection for Beam Transfer from the {CPS} to the {CERN} {300 GeV} Machine	C. Bovet and D. Fiander and L. Henny and A. Krusche and G. Plass	438	441	438-441
0442	A New Approach to the Transport of Heavy Charged Particles	E. A. Youssef and F. S. Chute and F. E. Vermeulen	442	446	442-446
0447	Production of a High Energy, High Power Polarized Photon Beam at {SLAC}	R. L. Eisele and D. J. Quinn and J. P. Rutheford and D. J. Sherden and M. A. Shupe and R. H. Siemann and C. K. Sinclair	447	450	447-450
0451	{SLAC} Storage Ring Beam Transport Instrumentation and Operation	T. V. Huang and D. Tsang	451	454	451-454
0455	High Intensity Stopped {K}-Meson Beam at the {Bevatron}	R. C. Sah and E. H. Hoyer and R. A. Kilpatrick and K. H. Lou and R. C. Wolgast	455	458	455-458
0459	New Approach to Shielding Calculations for Very High Energy Accelerators	Van Ginneken, A. and M. Awschalom	459	461	459-461
0462	Preliminary Observations on the Response of Accelerator Shielding Blocks to Earthquake Motions	W. G. Godden and M. Aslam and W. Peregoy and D. T. Scalise	462	464	462-464
0465	Tests and Description of Beam Containment Devices and Instrumentation—A New Dimension in Safety Problems	D. Walz and D. Busick and T. Constant and K. Crook and D. Fryberger and G. Gilbert and J. Jasberg and L. Keller and J. Murray and R. Vetterlein	465	471	465-471
0472	Rotating Target for Intense 14-{MeV} Neutron Source	R. Booth and H. H. Barschall and E. Goldberg	472	474	472-474
0475	Density Profiles of a Supersonic Jet Target	J. E. Brolley	475	477	475-477
0478	Space Charge Effects in High Current Linear Accelerator Transport Systems	G. Mavrogenes and T. Khoe and W. Wesolowski	478	480	478-480
0481	Beam Handling System of the {University of Maryland} Cyclotron	R. E. Berg and W. P. Johnson	481	482	481-482
0483	A {300 GeV} High Quality Electron and Pion Beam at the New Generation Proton Accelerators	Z. G. T. Guiragossian and R. E. Rand	483	487	483-487
0488	Problems in Design and Operation of {SuperHILAC} Beam Transport Systems	F. B. Selph	488	490	488-490
0491	Mechanical Design of a Delay Line for the Astron Linear Accelerator Beam Transport	C. A. Hurley	491	492	491-492
0493	Minimization of Aberrations in Beam Line Design	D. C. Carey	493	495	493-495
0496	Tuning and Operation of the External Proton Beam Lines of the {Zero Gradient Synchrotron (ZGS)}	R. B. Wehrle and Y. Cho and G. A. Concaildi and A. J. Creer and R. D. George and R. W. Nielsen	496	498	496-498
0499	Radiation Survey Vehicle for the {NAL} Main Ring	R. E. Shafer and D. D. Jovanovic	499	501	499-501
0502	Operation of the {NAL} Main Ring Extraction System	E. J. Bleser and H. T. Edwards and H. E. Fisk and F. Hornstra and J. D. McCarthy and L. W. Oleksiuk and Peoples, Jr., J. and C. H. Rode	502	504	502-504
0505	The {NAL} Computer Control System	R. E. Daniels and R. W. Goodwin and M. R. Storm	505	509	505-509
0510	Operational Aspects of the {SLAC} Main Control Center	K. Crook and T.V. Huang and G. Nelson and V. Price	510	513	510-513
0514	{CAMAC} Experimental Beam Line Control System	L. J. Hepinstall and E. J. Barsotti and H. C. Lau	514	517	514-517
0518	A New Diagnostic System for Studying the Injector and Injection at the {Zero Gradient Synchrotron (ZGS)}	R. L. Kustom and F. R. Brumwell and E. F. Parker and C. W. Potts and R. B. Wehrle	518	522	518-522
0523	The Beam Diagnostics System, Serving the {Serpukhov} Fast Ejection	J. Cupérus and F. Fabiani and I. Kamber and J. Nuttall	523	527	523-527
0528	Computer Programs for {AGS} Injection	H. N. Brown and J. Claus	528	530	528-530
0531	A Compact Programmable Control Panel for Computer Control Systems	B. L. Hartway	531	535	531-535
0536	Intercomputer Communications in Real Time Control Systems	S. R. Smith and R. W. Goodwin and M. R. Storm	536	540	536-540
0541	Some Effects of (Now Having) Computer Control for the {Stanford Linear Accelerator}	K. B. Mallory	541	543	541-543
0544	Detection of Optical Transition Radiation and Its Application to Beam Diagnostics	L. Wartski and J. Marcou and S. Roland	544	548	544-548
0549	Measurement of Bunch-Length by a Mode-Locked Laser with a Time Resolution of 10 Picoseconds	R. Fischer and R. Rossmanith	549	551	549-551
0552	A Modular Control System Utilizing {CAMAC} Hardware for Interfacing Remote Components at {NAL}	W. H. DeLuca and A. J. Maier and J. E. Michelsen and C. A. Swoboda	552	554	552-554
0555	Plotting of Beam Variation with $Q$ Value on the {5 GeV} Electron Syhnchrotron {NINA}	N. Marks and E. A. Hughes	555	557	555-557
0558	The Chromonitor, A Colorful Dynamic Graphic Display Terminal	F. H. G. Lothrop	558	560	558-560
0561	Advancements in Control Technology at the {Bevatron}	D. M. Evans and J. R. Guggemos and R. L. Kilgore and D. J. Rondeau	561	563	561-563
0564	Q Measurement with Swept {RC} Filter for Automatic Data Acquisition and Display	J. P. Potier and G. C. Schneider and E. Schulte	564	566	564-566
0567	A Precision Non-Linear Analog Transfer Function Generator	G. S. Tool	567	569	567-569
0570	Booster and Main Accelerator Phase Detector System for Cavity Tuning	E. F. Higgins	570	572	570-572
0573	Beam Monitoring in the Extraction Region of the {Nevis} Synchrocyclotron	E. Aslanides and R. C. Cohen and G. Dugan and W. Nagourney and L. Rosenstein and M. Slagowitz and K. Ziegler	573	575	573-575
0576	Controls for Operating and Processing the {MIT-LNS} Linac	J. N. Weaver	576	579	576-579
0580	Automatic Control Program for {SPEAR}	A. M. Boyarski and A. S. King and M. J. Lee and J. R. Rees and N. Spencer	580	583	580-583
0584	Computer-Based Visualization and Manipulation of Orbit Warps in the {Zero Gradient Synchrotron (ZGS)}	M. J. Knott and E. A. Crosbie	584	586	584-586
0587	Orthogonal Automatic Steering into the {Zero Gradient Synchrotron (ZGS)} Using Achromatic Magnets	R. E. Timm	587	589	587-589
0590	A Magnetic Beam Position Monitor	J. Claus	590	592	590-592
0593	{RF} Phase Control System	R. Sundelin and M. Tigner and E. von Borstel	593	595	593-595
0596	A System for Monitoring Proton Losses from the {NAL} Main Accelerator	R. A. Lundy and D. F. Sutter	596	598	596-598
0599	A Fast {RF} Structure Monitor	L. M. DeBall and D. E. Suddeth	599	601	599-601
0602	Air-Filled Ion Chamber Beam Loss Monitors for the {Zero Gradient Synchrotron (ZGS)}	D. E. Suddeth	602	604	602-604
0605	Derived Radial Position and Width Signals from a {TV} Beam Viewer	D. E. Suddeth	605	607	605-607
0608	Beam Phase Lock Using Amplitude Limited Pulse Comparison for the {Zero Gradient Synchrotron (ZGS)}	D. E. Suddeth and D. E. Bohringer	608	609	608-609
0610	A Fast Technique of Measuring Equilibrium Orbit Warps in the {Zero Gradient Synchrotron (ZGS)} at Injection	J. M. Bogaty	610	612	610-612
0613	Control of Ion Sources for the {Zero Gradient Synchrotron (ZGS)}	R. E. Timm	613	615	613-615
0616	{I.U.} Accelerator Control System Digital Multiplexer	T. E. Zinneman and B. M. Bardin	616	617	616-617
0618	Computer Control of the {Oak Ridge Isochronous Cyclotron}	C. A. Ludemann and J. M. Domaschko and K. Hagemann and S. W. Mosko	618	620	618-620
0621	Application of Crossbar Relays to the Control of a Buncher Ring	W. Gagnon and H. Lane and L. L. Reginato and B. H. Smith	621	623	621-623
0624	Position and Intensity Monitoring System for the {SPEAR} Transport System at {SLAC}	A. K. Chang and H. K. Kang and R. S. Larsen	624	630	624-630
0631	{CAMAC} Crate Controller for a Serial Control System	E. J. Barsotti	631	632	631-632
0633	The Central Control Room Man-Machine Interface at the {Clinton P. Anderson Meson Physics Facility (LAMPF)}	B. L. Hartway and J. Bergstein and C. M. Plopper	633	635	633-635
0636	Experience with Touch Panel Control at {SLAC}	W. C. Struven	636	637	636-637
0638	Monitoring the Beams in {SPEAR} with Synchrotron Light	A. P. Sabersky	638	641	638-641
0642	Computer Control of {Brookhaven} {200 MeV} Linac	I. Weitman	642	644	642-644
0645	Thin Film Mapping of Electron Accelerators	R. G. Little and M. B. Kime	645	647	645-647
0648	The Satellite Minicomputer--A Practical Solution to Accelerator Control	D. R. Machen and J. M. Potter	648	649	648-649
0650	Digital Filter Design for Accelerator Data and Control Systems	D. R. Machen	650	652	650-652
0653	{PRIMET}: A Versatile Accelerator Timing System	C. A. Swoboda and R. E. Daniels and H. C. Lau and A. Tummillo	653	655	653-655
0656	The Orbit Measurement System of the {CERN} {800 MeV} {PS Booster}	M. Rabany	656	658	656-658
0659	The {800 MeV} Measurement Line of the {CERN} {PS Booster}	G. Baribaud and C. Metzger	659	661	659-661
0662	High Energy Low Intensity Beam Profile Monitor	R. Chehab and C. N. Ngoc	662	664	662-664
0665	A Wide Band Current Monitor Based on Pulsed Transformer Techniques	D. F. Sutter	665	667	665-667
0668	Summary of International Progress on Superconducting Magnets	W. S. Gilbert	668	674	668-674
0675	The {Argonne} Superconducting Magnet for Polarized Proton Targets	J. Bywater and H. Desportes and D. Hill and C. Laverick and A. Moretti and J. Purcell	675	677	675-677
0678	Studies of Performance and Field Reproducibility of a Precision {40 kG} Superconducting Dipole Magnet	J. Allinger and G. Danby and B. DeVito and S. Hsieh and J. Jackson and A. Prodell	678	682	678-682
0683	Superconducting Beam-Transport Magnets for the {Bevatron}	W. S. Gilbert and R. C. Acker and W. F. Eaton and R. A. Kilpatrick and R. B. Meuser and F. L. Toby and F. Voelker	683	687	683-687
0688	Superconducting Magnet Models for {ISABELLE}	P. F. Dahl and R. Damm and D. D. Jacobus and C. Lasky and A. D. McInturff and G. H. Morgan and G. Parzen and W. B. Sampson	688	692	688-692
0693	Results of Physical Tests on Polymer Materials at Cryogenic Temperatures	Van de Voorde, M.	693	697	693-697
0698	High Field Pulsed Magnets for a Bubble Chamber Beam	R. T. Elliott and P. S. Flower	698	702	698-702
0703	The Computation of Poleface Winding Systems Yielding Independent Multipole Fields within the Aperture of Notably Alternating Gradient Synchrotron Magnets	A. Asner and R. Holsinger and C. Iselin	703	707	703-707
0708	Radiation Resistant Magnet Coils from Hard Anodized Aluminum Conductor	M. M. Holland and J. Shill	708	712	708-712
0713	Design of Sextupole Magnet for {200 GeV} Line	J. A. Satti and S. C. Snowdon	713	715	713-715
0716	Modification of {LINDA} to Treat the Grain Orientation Effect	K. Endo and T. Igarashi and T. Kasuga and M. Kihara and E. Takasaki	716	718	716-718
0719	Septum Magnets for Secondary Beams at {NAL}	Carrigan, Jr., R. and J. Jagger and G. Michelassi and K. Pretzl and J. Satti and S. Snowdon and A. Wehmann	719	722	719-722
0723	Calculations on High Field Magnets with Iron Yokes and Rectangular Coils	H. H. Umstütter	723	725	723-725
0726	Design of Dipole Magnet with Circular Iron Shield	W. W. Lee and S. C. Snowdon	726	728	726-728
0729	{Zero Gradient Synchrotron} Coil Failures in 1970-71 Analysis and Subsequent Remedial Action	J. H. Martin and D. Jovanovic and L. G. Lewis and E. G. Pewitt and W. Praeg and V. J. Sevcik	729	730	729-730
0731	Improvements in the {Zero Gradient Synchrotron (ZGS)} Main Magnet Coil Protection	D. E. Suddeth and C. W. Potts and W. F. Praeg	731	733	731-733
0734	Main Magnet Coil Diagnostic Tests at the {Zero Gradient Synchrotron (ZGS)}	D. E. Suddeth	734	736	734-736
0737	A Pulsed Beam Shutter for Radio-Frequency Separated Beams at the {ZGS}	W. F. Praeg	737	739	737-739
0740	Multiparticle Spectrometer Magnet ({MPS})	E. E. Halik	740	741	740-741
0742	Resistive Measurements on an Improved {Nb-Al-Ge} Superconducting Ribbon	T. W. Eagar and R. M. Rose	742	743	742-743
0744	Preliminary Modeling and Testing of Ramped Superconducting Dipoles for the {NAL} Doubler	P. J. Reardon and R. McCracken and M. A. Otavka and D. Richied and B. P. Strauss and D. Sutter	744	746	744-746
0747	Operating Results from {ISR}	W. Schnell	747	751	747-751
0752	Operating Results from {SPEAR}	{SPEAR Storage Ring Group}	752	755	752-755
0756	Storage Ring Program in {Novosibirsk}	A. N. Skrinsky	756	759	756-759
0760	Beam Induced Gas Desorption in the {CERN} {Intersecting Storage Rings}	O. Gröbner and R. S. Calder	760	764	760-764
